slug,title,description,difficulty,categories,companyTags,externalPlatformUrl,solutionUrl
maximum-and-minimum-element-in-array,Maximum and Minimum Element in an Array,Find maximum and minimum elements in an array,Easy,Array,"Amazon,Microsoft,Google,Adobe,Cisco,Hike,VMWare,ABCO,Accolite,Snapdeal",https://www.geeksforgeeks.org/maximum-and-minimum-in-an-array/,
reverse-the-array,Reverse the Array,Reverse an array or string,Easy,Array,"Infosys,Moonfrog Labs",https://www.geeksforgeeks.org/write-a-program-to-reverse-an-array-or-string/,
maximum-subarray,Maximum Subarray (Kadane's Algorithm),Find the contiguous subarray with the largest sum,Medium,"Array,Dynamic Programming","Microsoft,Facebook",https://leetcode.com/problems/maximum-subarray/,
contains-duplicate,Contains Duplicate,Check if array contains any duplicates,Easy,"Array,Hash Table,Sorting",Amazon,https://leetcode.com/problems/contains-duplicate/,
chocolate-distribution-problem,Chocolate Distribution Problem,Distribute chocolates such that difference between max and min is minimized,Easy,"Array,Sorting",Amazon,https://www.geeksforgeeks.org/chocolate-distribution-problem/,
search-in-rotated-sorted-array,Search in Rotated Sorted Array,Search for a target value in a rotated sorted array,Medium,"Array,Binary Search","Amazon,Microsoft,Google,Adobe,D-E-Shaw,Flipkart,Hike,Intuit,MakeMyTrip,Paytm",https://leetcode.com/problems/search-in-rotated-sorted-array/,
next-permutation,Next Permutation,Find the next lexicographically greater permutation,Medium,"Array,Two Pointers","Uber,Goldman Sachs,Adobe",https://leetcode.com/problems/next-permutation/,
best-time-to-buy-and-sell-stock,Best Time to Buy and Sell Stock,Find maximum profit from buying and selling stock,Easy,"Array,Dynamic Programming","Amazon,Microsoft,Google,D-E-Shaw,Directi,Flipkart,Goldman Sachs,Intuit,MakeMyTrip,Ola Cabs,Oracle,Paytm,Pubmatic,Quikr,Salesforce,Sapient,Swiggy,Walmart,Media.net",https://leetcode.com/problems/best-time-to-buy-and-sell-stock/,
repeat-and-missing-number,Repeat and Missing Number Array,Find the repeating and missing number in an array,Medium,"Array,Hash Table,Math,Bit Manipulation",Amazon,https://www.interviewbit.com/problems/repeat-and-missing-number-array/,
kth-largest-element,Kth Largest Element in an Array,Find the kth largest element in an unsorted array,Medium,"Array,Divide and Conquer,Sorting,Heap,Quickselect","Amazon,Microsoft,Walmart,Adobe",https://leetcode.com/problems/kth-largest-element-in-an-array/,
trapping-rain-water,Trapping Rain Water,Calculate how much water can be trapped after raining,Hard,"Array,Two Pointers,Dynamic Programming,Stack,Monotonic Stack",Samsung,https://leetcode.com/problems/trapping-rain-water/,
product-of-array-except-self,Product of Array Except Self,Return array where each element is product of all other elements,Medium,"Array,Prefix Sum","Amazon,Microsoft,Google,Facebook,Apple",https://leetcode.com/problems/product-of-array-except-self/,
find-minimum-in-rotated-sorted-array,Find Minimum in Rotated Sorted Array,Find the minimum element in a rotated sorted array,Medium,"Array,Binary Search","Amazon,Microsoft,Adobe,Morgan Stanley,Samsung,Snapdeal,Times Internet",https://leetcode.com/problems/find-minimum-in-rotated-sorted-array/,
find-pair-with-given-sum-in-sorted-rotated-array,Find Pair with Given Sum in Sorted & Rotated Array,Find if there exists a pair with given sum,Medium,"Array,Two Pointers","Microsoft,Google,Apple",https://www.geeksforgeeks.org/given-a-sorted-and-rotated-array-find-if-there-is-a-pair-with-a-given-sum/,
3sum,3Sum,Find all unique triplets that sum to zero,Medium,"Array,Two Pointers,Sorting","Amazon,Microsoft,Google,Facebook,Adobe,Bloomberg",https://leetcode.com/problems/3sum/,
container-with-most-water,Container With Most Water,Find two lines that together with x-axis forms a container with most water,Medium,"Array,Two Pointers,Greedy","Amazon,Google,Facebook,Bloomberg",https://leetcode.com/problems/container-with-most-water/,
3sum-closest,3Sum Closest,Find three integers whose sum is closest to target,Medium,"Array,Two Pointers,Sorting","Amazon,Bloomberg",https://leetcode.com/problems/3sum-closest/,
given-sum-pair-count,Given Sum Pair Count,Count pairs with given sum,Easy,"Array,Hash Table","Amazon,Accolite,MakeMyTrip",https://www.geeksforgeeks.org/count-pairs-with-given-sum/,
common-elements,Common Elements in Three Sorted Arrays,Find common elements in three sorted arrays,Easy,"Array,Hash Table,Two Pointers","Amazon,Microsoft,Google,Goldman Sachs",https://www.geeksforgeeks.org/find-common-elements-three-sorted-arrays/,
rearrange-array-alternately,Rearrange Array Alternately,Rearrange array in alternating positive and negative items,Medium,Array,"Amazon,Microsoft,MAQ Software,Adobe",https://www.geeksforgeeks.org/rearrange-array-alternating-positive-negative-items-o1-extra-space/,
subarray-sum-equals-k,Subarray Sum Equals K,Find total number of continuous subarrays whose sum equals to k,Medium,"Array,Hash Table,Prefix Sum","Amazon,Microsoft,Google,Facebook",https://leetcode.com/problems/subarray-sum-equals-k/,
factorials-of-large-numbers,Factorials of Large Numbers,Calculate factorial of large numbers,Medium,"Array,Math","Amazon,Paytm,Accolite",https://www.geeksforgeeks.org/factorial-large-number/,
max-product-subarray,Maximum Product Subarray,Find the contiguous subarray with the largest product,Medium,"Array,Dynamic Programming","Amazon,Microsoft,Google,LinkedIn",https://leetcode.com/problems/maximum-product-subarray/,
longest-consecutive-subsequence,Longest Consecutive Subsequence,Find length of longest consecutive elements sequence,Medium,"Array,Hash Table,Union Find","Amazon,Microsoft,Google,Facebook,Flipkart",https://leetcode.com/problems/longest-consecutive-sequence/,
array-subset-of-another-array,Array Subset of Another Array,Check if array is subset of another array,Easy,"Array,Hash Table","Amazon,Flipkart,Microsoft",https://www.geeksforgeeks.org/find-whether-an-array-is-subset-of-another-array-set-1/,
triplet-sum-in-array,Triplet Sum in Array,Find if there exists a triplet with given sum,Medium,"Array,Two Pointers,Sorting","Amazon,Microsoft,MAQ Software",https://www.geeksforgeeks.org/find-a-triplet-that-sum-to-a-given-value/,
stickler-thief,Stickler Thief (House Robber),Maximum sum such that no two elements are adjacent,Easy,"Array,Dynamic Programming","Amazon,Microsoft,Adobe",https://www.geeksforgeeks.org/find-maximum-possible-stolen-value-houses/,
smallest-subarray-with-sum-greater-than-x,Smallest Subarray with Sum Greater Than X,Find smallest subarray with sum greater than given value,Medium,"Array,Sliding Window","Amazon,Flipkart,Microsoft",https://www.geeksforgeeks.org/minimum-length-subarray-sum-greater-given-value/,
find-all-pairs-with-given-sum,Find All Pairs with a Given Sum,Find all pairs of elements with given sum,Easy,"Array,Hash Table","Amazon,Microsoft",https://www.geeksforgeeks.org/count-pairs-with-given-sum/,
four-sum,4Sum,Find all unique quadruplets that sum to target,Medium,"Array,Two Pointers,Sorting","Amazon,Microsoft,Facebook",https://leetcode.com/problems/4sum/,
merge-intervals,Merge Intervals,Merge all overlapping intervals,Medium,"Array,Sorting","Amazon,Microsoft,Google,Facebook,LinkedIn",https://leetcode.com/problems/merge-intervals/,
next-greater-element,Next Greater Element,Find next greater element for each element,Medium,"Array,Stack,Monotonic Stack","Amazon,Google,Flipkart",https://leetcode.com/problems/next-greater-element-i/,
level-of-nodes,Level of Nodes,Find level of each node in binary tree,Medium,"Array,Tree,Breadth-First Search",Amazon,https://www.geeksforgeeks.org/get-level-of-a-node-in-a-binary-tree/,
reverse-array-in-groups,Reverse Array in Groups,Reverse every sub-array of group k,Easy,Array,"Amazon,Microsoft,Accolite",https://www.geeksforgeeks.org/reverse-an-array-in-groups-of-given-size/,
k-th-element-in-matrix,K-th Element in Matrix,Find kth smallest element in row-column wise sorted matrix,Medium,"Array,Binary Search,Matrix,Sorting,Heap","Amazon,Microsoft,Google",https://www.geeksforgeeks.org/kth-smallest-element-in-a-row-wise-and-column-wise-sorted-2d-array-set-1/,
spirally-traversing-a-matrix,Spirally Traversing a Matrix,Print matrix in spiral form,Medium,"Array,Matrix,Simulation","Amazon,Microsoft,Google,Facebook,Adobe",https://leetcode.com/problems/spiral-matrix/,
largest-number-formed-from-array,Largest Number Formed from Array,Arrange numbers to form the largest number,Medium,"Array,String,Greedy,Sorting","Amazon,Microsoft,Google,Adobe",https://leetcode.com/problems/largest-number/,
first-repeating-element,First Repeating Element,Find first repeating element in an array,Easy,"Array,Hash Table","Amazon,Accolite,MakeMyTrip",https://www.geeksforgeeks.org/find-first-repeating-element-array-integers/,
first-non-repeating-element,First Non-Repeating Element,Find first non-repeating element in array,Easy,"Array,Hash Table","Amazon,Accolite",https://www.geeksforgeeks.org/non-repeating-element/,
top-k-frequent-elements,Top K Frequent Elements,Find k most frequent elements in array,Medium,"Array,Hash Table,Divide and Conquer,Sorting,Heap,Bucket Sort,Counting,Quickselect","Amazon,Microsoft,Google,Facebook,Yelp",https://leetcode.com/problems/top-k-frequent-elements/,
sort-by-frequency,Sorting Elements of an Array by Frequency,Sort array elements by frequency,Medium,"Array,Hash Table,Sorting","Amazon,Microsoft,Accolite,Adobe",https://www.geeksforgeeks.org/sort-elements-by-frequency/,
minimum-swaps-to-sort,Minimum Swaps to Sort,Find minimum number of swaps required to sort array,Medium,"Array,Graph,Sorting","Amazon,Microsoft,Google",https://www.geeksforgeeks.org/minimum-number-swaps-required-sort-array/,
count-distinct-elements,Count Distinct Elements in Every Window,Count distinct elements in every window of size k,Easy,"Array,Hash Table,Sliding Window","Amazon,Google",https://www.geeksforgeeks.org/count-distinct-elements-in-every-window-of-size-k/,
smallest-positive-missing-number,Smallest Positive Missing Number,Find the smallest positive integer missing from array,Medium,"Array,Hash Table","Amazon,Microsoft,Accolite,D-E-Shaw,Hike,Lybrate,Mahindra Comviva,MakeMyTrip,MAQ Software,OYO Rooms,Paytm,Qualcomm,Samsung,SAP Labs,Snapdeal,Veritas,VMWare,Walmart,Adobe",https://leetcode.com/problems/first-missing-positive/,
rearrange-positive-negative,Rearrange Positive and Negative Numbers,Rearrange array in alternating positive & negative items,Medium,"Array,Two Pointers","Amazon,Microsoft,Accolite,Adobe",https://www.geeksforgeeks.org/rearrange-array-alternating-positive-negative-items-o1-extra-space/,
find-duplicates-in-array,Find All Duplicates in an Array,Find all elements that appear twice,Medium,"Array,Hash Table","Amazon,Microsoft,Google,Pocket Gems",https://leetcode.com/problems/find-all-duplicates-in-an-array/,
zero-sum-subarrays,Zero Sum Subarrays,Count subarrays with sum equals to 0,Medium,"Array,Hash Table","Amazon,Flipkart",https://www.geeksforgeeks.org/print-all-subarrays-with-0-sum/,
longest-subarray-with-sum-k,Longest Sub-Array with Sum K,Find length of longest subarray with sum k,Easy,"Array,Hash Table","Amazon,Flipkart,Microsoft",https://www.geeksforgeeks.org/longest-sub-array-sum-k/,
reverse-string,Reverse a String,Reverse the given string,Easy,"String,Two Pointers","Amazon,Microsoft,Google",https://leetcode.com/problems/reverse-string/,
check-palindrome,Check if String is Palindrome,Check whether a string is palindrome or not,Easy,"String,Two Pointers","Amazon,Microsoft,Facebook",https://leetcode.com/problems/valid-palindrome/,
find-duplicate-characters,Find Duplicate Characters in a String,Print all duplicate characters in string,Easy,"String,Hash Table","Amazon,Microsoft",https://www.geeksforgeeks.org/print-all-the-duplicates-in-the-input-string/,
check-string-rotation,Check if Strings are Rotations,Check if one string is rotation of another,Easy,"String,String Matching","Amazon,Microsoft,Google",https://www.geeksforgeeks.org/a-program-to-check-if-strings-are-rotations-of-each-other/,
valid-shuffle,Valid Shuffle,Check if string is valid shuffle of two strings,Medium,"String,Two Pointers",Amazon,https://www.geeksforgeeks.org/check-if-a-string-is-a-valid-shuffle-of-two-strings/,
count-and-say,Count and Say,Generate nth term of count-and-say sequence,Medium,String,"Amazon,Microsoft,Facebook",https://leetcode.com/problems/count-and-say/,
longest-palindromic-substring,Longest Palindrome in a String,Find longest palindromic substring,Medium,"String,Dynamic Programming","Amazon,Microsoft,Google,Facebook,Apple,Adobe",https://leetcode.com/problems/longest-palindromic-substring/,
longest-repeating-subsequence,Longest Repeating Subsequence,Find length of longest repeating subsequence,Medium,"String,Dynamic Programming","Amazon,Microsoft,Google",https://www.geeksforgeeks.org/longest-repeating-subsequence/,
print-anagrams-together,Print Anagrams Together,Group all anagrams together,Medium,"String,Hash Table,Sorting","Amazon,Microsoft,Google,Facebook,Uber,Bloomberg",https://leetcode.com/problems/group-anagrams/,
smallest-window-containing-substring,Smallest Window Containing All Characters,Find smallest window containing all characters of pattern,Hard,"String,Hash Table,Sliding Window","Amazon,Microsoft,Google,Facebook",https://leetcode.com/problems/minimum-window-substring/,
insert-node-in-linked-list,Insert a Node in Linked List,Insert a node at given position in linked list,Easy,Linked List,"Amazon,Microsoft",https://www.geeksforgeeks.org/linked-list-set-2-inserting-a-node/,
delete-node-in-linked-list,Delete a Node in Linked List,Delete a node from linked list,Easy,Linked List,"Amazon,Microsoft,Google",https://leetcode.com/problems/delete-node-in-a-linked-list/,
reverse-linked-list,Reverse a Linked List,Reverse a singly linked list,Easy,"Linked List,Recursion","Amazon,Microsoft,Google,Facebook,Apple,Adobe",https://leetcode.com/problems/reverse-linked-list/,
detect-loop-in-linked-list,Detect Loop in Linked List,Detect if linked list has a cycle,Easy,"Hash Table,Linked List,Two Pointers","Amazon,Microsoft,Google,Facebook",https://leetcode.com/problems/linked-list-cycle/,
remove-loop-in-linked-list,Remove Loop in Linked List,Detect and remove loop in linked list,Medium,"Hash Table,Linked List,Two Pointers","Amazon,Microsoft,Accolite,Adobe",https://www.geeksforgeeks.org/detect-and-remove-loop-in-a-linked-list/,
find-length-of-loop,Find Length of Loop,Find length of loop in linked list,Easy,"Linked List,Two Pointers","Amazon,Microsoft",https://www.geeksforgeeks.org/find-length-of-loop-in-linked-list/,
middle-of-linked-list,Find Middle of the Linked List,Find middle node of linked list,Easy,"Linked List,Two Pointers","Amazon,Microsoft,Facebook",https://leetcode.com/problems/middle-of-the-linked-list/,
nth-node-from-end,Nth Node from End of Linked List,Find nth node from end of linked list,Easy,"Linked List,Two Pointers","Amazon,Microsoft,Google",https://leetcode.com/problems/remove-nth-node-from-end-of-list/,
merge-two-sorted-linked-lists,Merge Two Sorted Linked Lists,Merge two sorted linked lists,Easy,"Linked List,Recursion","Amazon,Microsoft,Google,Facebook,Apple,Adobe",https://leetcode.com/problems/merge-two-sorted-lists/,
palindrome-linked-list,Check if Linked List is Palindrome,Check if linked list is palindrome,Easy,"Linked List,Two Pointers,Stack,Recursion","Amazon,Microsoft,Facebook,Apple",https://leetcode.com/problems/palindrome-linked-list/,
implement-stack-using-arrays,Implement Stack using Arrays,Implement stack data structure using array,Easy,"Array,Stack,Design","Amazon,Microsoft",https://www.geeksforgeeks.org/stack-data-structure-introduction-program/,
implement-queue-using-arrays,Implement Queue using Arrays,Implement queue data structure using array,Easy,"Array,Queue,Design","Amazon,Microsoft",https://www.geeksforgeeks.org/queue-set-1introduction-and-array-implementation/,
implement-two-stacks-in-array,Implement Two Stacks in an Array,Implement two stacks using single array,Easy,"Array,Stack,Design","Amazon,Microsoft,Flipkart",https://www.geeksforgeeks.org/implement-two-stacks-in-an-array/,
implement-stack-using-queue,Implement Stack using Queue,Implement stack using queue data structure,Easy,"Stack,Design,Queue","Amazon,Microsoft,Bloomberg",https://leetcode.com/problems/implement-stack-using-queues/,
valid-parentheses,Valid Parentheses,Check if parentheses in string are valid,Easy,"String,Stack","Amazon,Microsoft,Google,Facebook,Bloomberg",https://leetcode.com/problems/valid-parentheses/,
next-greater-element-stack,Next Greater Element,Find next greater element for each element using stack,Medium,"Array,Stack,Monotonic Stack","Amazon,Google,Flipkart",https://leetcode.com/problems/next-greater-element-i/,
largest-rectangle-histogram,Largest Rectangle in Histogram,Find area of largest rectangle in histogram,Hard,"Array,Stack,Monotonic Stack","Amazon,Microsoft,Google,Facebook,Uber",https://leetcode.com/problems/largest-rectangle-in-histogram/,
min-stack,Min Stack,Design stack with getMin operation,Medium,"Stack,Design","Amazon,Microsoft,Google,Bloomberg",https://leetcode.com/problems/min-stack/,
height-of-binary-tree,Height of Binary Tree,Find height/depth of binary tree,Easy,"Tree,Depth-First Search,Breadth-First Search,Binary Tree","Amazon,Microsoft,Google,Facebook",https://leetcode.com/problems/maximum-depth-of-binary-tree/,
diameter-of-binary-tree,Diameter of Binary Tree,Find diameter of binary tree,Easy,"Tree,Depth-First Search,Binary Tree","Amazon,Microsoft,Google,Facebook",https://leetcode.com/problems/diameter-of-binary-tree/,
mirror-tree,Mirror Tree,Convert tree into its mirror tree,Easy,"Tree,Depth-First Search,Breadth-First Search,Binary Tree","Amazon,Microsoft,Google",https://leetcode.com/problems/invert-binary-tree/,
inorder-traversal,Inorder Traversal,Inorder traversal of binary tree,Easy,"Stack,Tree,Depth-First Search,Binary Tree","Amazon,Microsoft,Google,Facebook",https://leetcode.com/problems/binary-tree-inorder-traversal/,
preorder-traversal,Preorder Traversal,Preorder traversal of binary tree,Easy,"Stack,Tree,Depth-First Search,Binary Tree","Amazon,Microsoft,Google",https://leetcode.com/problems/binary-tree-preorder-traversal/,
postorder-traversal,Postorder Traversal,Postorder traversal of binary tree,Easy,"Stack,Tree,Depth-First Search,Binary Tree","Amazon,Microsoft,Google",https://leetcode.com/problems/binary-tree-postorder-traversal/,
level-order-traversal,Level Order Traversal,Level order traversal of binary tree,Medium,"Tree,Breadth-First Search,Binary Tree","Amazon,Microsoft,Google,Facebook,LinkedIn",https://leetcode.com/problems/binary-tree-level-order-traversal/,
left-view-of-tree,Left View of Binary Tree,Print left view of binary tree,Easy,"Tree,Depth-First Search,Breadth-First Search,Binary Tree","Amazon,Microsoft,Adobe",https://www.geeksforgeeks.org/print-left-view-binary-tree/,
right-view-of-tree,Right View of Binary Tree,Print right view of binary tree,Medium,"Tree,Depth-First Search,Breadth-First Search,Binary Tree","Amazon,Microsoft,Facebook,Bloomberg",https://leetcode.com/problems/binary-tree-right-side-view/,
top-view-of-tree,Top View of Binary Tree,Print top view of binary tree,Medium,"Tree,Depth-First Search,Breadth-First Search,Binary Tree","Amazon,Microsoft,Flipkart",https://www.geeksforgeeks.org/print-nodes-top-view-binary-tree/,
bfs-traversal,BFS Traversal,Breadth-first search traversal of graph,Easy,"Breadth-First Search,Graph","Amazon,Microsoft,Google,Facebook",https://www.geeksforgeeks.org/breadth-first-search-or-bfs-for-a-graph/,
dfs-traversal,DFS Traversal,Depth-first search traversal of graph,Easy,"Depth-First Search,Graph","Amazon,Microsoft,Google",https://www.geeksforgeeks.org/depth-first-search-or-dfs-for-a-graph/,
detect-cycle-in-directed-graph,Detect Cycle in Directed Graph,Detect cycle in directed graph,Medium,"Depth-First Search,Breadth-First Search,Graph","Amazon,Microsoft,Google,Facebook",https://www.geeksforgeeks.org/detect-cycle-in-a-graph/,
detect-cycle-in-undirected-graph,Detect Cycle in Undirected Graph,Detect cycle in undirected graph,Medium,"Depth-First Search,Breadth-First Search,Union Find,Graph","Amazon,Microsoft,Google",https://www.geeksforgeeks.org/detect-cycle-undirected-graph/,
topological-sort,Topological Sort,Topological sorting of directed acyclic graph,Medium,"Depth-First Search,Breadth-First Search,Graph,Topological Sort","Amazon,Microsoft,Google,Facebook",https://www.geeksforgeeks.org/topological-sorting/,
number-of-islands,Number of Islands,Count number of islands in 2D grid,Medium,"Array,Depth-First Search,Breadth-First Search,Union Find,Matrix","Amazon,Microsoft,Google,Facebook,Uber,Bloomberg",https://leetcode.com/problems/number-of-islands/,
dijkstra-algorithm,Dijkstra's Algorithm,Find shortest path using Dijkstra's algorithm,Medium,"Graph,Shortest Path,Heap","Amazon,Microsoft,Google,Facebook,Uber",https://www.geeksforgeeks.org/dijkstras-shortest-path-algorithm-greedy-algo-7/,
prims-algorithm,Prim's Algorithm,Minimum spanning tree using Prim's algorithm,Medium,"Union Find,Graph,Heap,Minimum Spanning Tree","Amazon,Microsoft,Google",https://www.geeksforgeeks.org/prims-minimum-spanning-tree-mst-greedy-algo-5/,
fibonacci-number,Fibonacci Number,Find nth Fibonacci number,Easy,"Math,Dynamic Programming,Recursion,Memoization","Amazon,Microsoft,Google",https://leetcode.com/problems/fibonacci-number/,
climbing-stairs,Climbing Stairs,Count ways to climb n stairs,Easy,"Math,Dynamic Programming,Memoization","Amazon,Microsoft,Google,Adobe,Apple",https://leetcode.com/problems/climbing-stairs/,
coin-change,Coin Change,Minimum coins needed to make amount,Medium,"Array,Dynamic Programming,Breadth-First Search","Amazon,Microsoft,Google,Facebook,Uber,Apple",https://leetcode.com/problems/coin-change/,
longest-common-subsequence,Longest Common Subsequence,Find length of LCS,Medium,"String,Dynamic Programming","Amazon,Microsoft,Google,Facebook",https://leetcode.com/problems/longest-common-subsequence/,
longest-increasing-subsequence,Longest Increasing Subsequence,Find length of LIS,Medium,"Array,Binary Search,Dynamic Programming","Amazon,Microsoft,Google,Facebook,Uber,Adobe",https://leetcode.com/problems/longest-increasing-subsequence/,
edit-distance,Edit Distance,Minimum operations to convert one string to another,Medium,"String,Dynamic Programming","Amazon,Microsoft,Google,Facebook,Bloomberg",https://leetcode.com/problems/edit-distance/,
0-1-knapsack,0-1 Knapsack Problem,Classic 0-1 knapsack problem,Medium,"Array,Dynamic Programming","Amazon,Microsoft,Google",https://www.geeksforgeeks.org/0-1-knapsack-problem-dp-10/,
matrix-chain-multiplication,Matrix Chain Multiplication,Minimum cost to multiply chain of matrices,Hard,"Array,Dynamic Programming","Amazon,Microsoft,Google",https://www.geeksforgeeks.org/matrix-chain-multiplication-dp-8/,
partition-equal-subset-sum,Partition Equal Subset Sum,Check if array can be partitioned into two equal sum subsets,Medium,"Array,Dynamic Programming","Amazon,Microsoft,Google,Facebook",https://leetcode.com/problems/partition-equal-subset-sum/,
egg-dropping-puzzle,Egg Dropping Puzzle,Find minimum trials in worst case,Hard,"Math,Binary Search,Dynamic Programming","Amazon,Microsoft,Google,Bloomberg",https://leetcode.com/problems/super-egg-drop/,
activity-selection,Activity Selection Problem,Select maximum number of activities,Easy,"Greedy,Array,Sorting","Amazon,Microsoft,Google",https://www.geeksforgeeks.org/activity-selection-problem-greedy-algo-1/,
n-meetings-in-one-room,N Meetings in One Room,Find maximum number of meetings,Easy,"Greedy,Array,Sorting","Amazon,Flipkart,Microsoft",https://www.geeksforgeeks.org/find-maximum-meetings-in-one-room/,
job-sequencing-problem,Job Sequencing Problem,Schedule jobs to maximize profit,Medium,"Greedy,Array,Sorting","Amazon,Microsoft,Flipkart",https://www.geeksforgeeks.org/job-sequencing-problem/,
fractional-knapsack,Fractional Knapsack,Maximize value in knapsack with fractional items,Medium,"Greedy,Array,Sorting","Amazon,Microsoft",https://www.geeksforgeeks.org/fractional-knapsack-problem/,
huffman-coding,Huffman Coding,Build Huffman tree for compression,Medium,"Greedy,Tree,Heap","Amazon,Microsoft,Google",https://www.geeksforgeeks.org/huffman-coding-greedy-algo-3/,
n-queens,N-Queens Problem,Place N queens on NxN chessboard,Hard,"Array,Backtracking","Amazon,Microsoft,Google,Uber",https://leetcode.com/problems/n-queens/,
rat-in-a-maze,Rat in a Maze,Find all paths for rat to reach destination,Medium,"Array,Backtracking,Matrix","Amazon,Flipkart,Microsoft,Samsung",https://www.geeksforgeeks.org/rat-in-a-maze/,
sudoku-solver,Sudoku Solver,Solve a 9x9 Sudoku puzzle,Hard,"Array,Backtracking,Matrix","Amazon,Microsoft,Google,Facebook,Uber,Snapchat",https://leetcode.com/problems/sudoku-solver/,
permutations,Permutations,Generate all permutations of array,Medium,"Array,Backtracking","Amazon,Microsoft,Google,Facebook,LinkedIn",https://leetcode.com/problems/permutations/,
combination-sum,Combination Sum,Find all combinations that sum to target,Medium,"Array,Backtracking","Amazon,Microsoft,Google,Facebook,Airbnb",https://leetcode.com/problems/combination-sum/,
count-set-bits,Count Set Bits,Count number of set bits in integer,Easy,Bit Manipulation,"Amazon,Microsoft,Google",https://leetcode.com/problems/number-of-1-bits/,
power-of-two,Power of Two,Check if number is power of two,Easy,"Math,Bit Manipulation,Recursion","Amazon,Microsoft,Google",https://leetcode.com/problems/power-of-two/,
find-xor-from-1-to-n,Find XOR from 1 to N,Calculate XOR of all numbers from 1 to n,Easy,"Math,Bit Manipulation",Amazon,https://www.geeksforgeeks.org/calculate-xor-1-n/,
single-number,Single Number,Find the element that appears only once,Easy,"Array,Bit Manipulation","Amazon,Microsoft,Google,Facebook,Apple",https://leetcode.com/problems/single-number/,
